{"abiVersion":6,"bindings":[{"backendSupport":[{"backend":"cuda","dtypes":["Float32"],"notes":""},{"backend":"hip","dtypes":["Float32"],"notes":""},{"backend":"opencl","dtypes":["Float32"],"notes":""},{"backend":"vulkan","dtypes":["Float32"],"notes":""},{"backend":"metal","dtypes":["Float32"],"notes":""}],"contractId":"navatala://python/linalg/axpy","determinism":"backend_default","dispatchVariants":[],"doc":{"details":"The Python binding accepts DLPack-compatible tensors and returns the updated y tensor.","examples":[],"summary":"Compute y = alpha * x + y on the selected GPU backend."},"launchPolicy":{"dispatch":null,"gridStride":true,"workgroupSize":null},"maturity":"experimental","module":"linalg","name":"navatala://python/linalg/axpy","preconditions":[{"errorCode":"invalid_shape","expr":{"kind":"shape_equals","lhs":"x","rhs":"y"},"message":"x and y must have identical shape"}],"publicModule":"linalg","publicName":"linalg.axpy","pythonName":"axpy","releasesGIL":true,"returnsDlpackTensor":true,"scalars":[{"defaultValue":{"kind":"float","value":"1.000000"},"kind":{"kind":"float"},"name":"alpha","optional":true},{"defaultValue":{"kind":"string","value":"auto"},"kind":{"kind":"backend"},"name":"backend","optional":true}],"syncPolicy":{"insertsHostSync":false,"notes":"The binding returns after enqueue unless the caller requests synchronization.","userVisible":"explicit_only"},"target":{"kind":"operation","name":"navatala://python/linalg/axpy/target"},"tensors":[{"contiguity":"c_contiguous","contiguityFallback":"copy_to_contiguous","dlpackAccepted":true,"dtype":{"dtype":"Float32","kind":"fixed"},"name":"x","numpyAccepted":true,"optional":false,"ownership":"borrowed","role":"input","shape":{"dims":["n"],"kind":"parametric"}},{"contiguity":"c_contiguous","contiguityFallback":"copy_to_contiguous","dlpackAccepted":true,"dtype":{"dtype":"Float32","kind":"fixed"},"name":"y","numpyAccepted":true,"optional":false,"ownership":"borrowed","role":"inout","shape":{"argument":"x","kind":"same_as"}}]},{"backendSupport":[{"backend":"cuda","dtypes":["Float32"],"notes":""},{"backend":"hip","dtypes":["Float32"],"notes":""},{"backend":"opencl","dtypes":["Float32"],"notes":""},{"backend":"vulkan","dtypes":["Float32"],"notes":""},{"backend":"metal","dtypes":["Float32"],"notes":""}],"contractId":"navatala://python/linalg/axpy_dispatch","determinism":"backend_default","dispatchVariants":[{"backend":null,"dtype":"Float32","notes":"Portable f32 AXPY dispatch variant.","target":{"kind":"operation","name":"navatala://python/linalg/axpy/target"}}],"doc":{"details":"The Python binding validates dispatch-group dtype routing before invoking the concrete AXPY implementation.","examples":[],"summary":"Compute y = alpha * x + y through a dtype-dispatched binding group."},"launchPolicy":{"dispatch":null,"gridStride":true,"workgroupSize":null},"maturity":"experimental","module":"linalg","name":"navatala://python/linalg/axpy_dispatch","preconditions":[{"errorCode":"invalid_shape","expr":{"kind":"shape_equals","lhs":"x","rhs":"y"},"message":"x and y must have identical shape"},{"errorCode":"invalid_dtype","expr":{"kind":"dtype_equals","lhs":"x","rhs":"y"},"message":"x and y must have identical dtype"}],"publicModule":"linalg","publicName":"linalg.axpy_dispatch","pythonName":"axpy_dispatch","releasesGIL":true,"returnsDlpackTensor":true,"scalars":[{"defaultValue":{"kind":"float","value":"1.000000"},"kind":{"kind":"float"},"name":"alpha","optional":true},{"defaultValue":{"kind":"string","value":"auto"},"kind":{"kind":"backend"},"name":"backend","optional":true}],"syncPolicy":{"insertsHostSync":false,"notes":"The binding returns after enqueue unless the caller requests synchronization.","userVisible":"explicit_only"},"target":{"kind":"dispatch_group","name":"navatala://python/linalg/axpy_dispatch/target"},"tensors":[{"contiguity":"c_contiguous","contiguityFallback":"copy_to_contiguous","dlpackAccepted":true,"dtype":{"dtypes":["Float32"],"kind":"one_of"},"name":"x","numpyAccepted":true,"optional":false,"ownership":"borrowed","role":"input","shape":{"dims":["n"],"kind":"parametric"}},{"contiguity":"c_contiguous","contiguityFallback":"copy_to_contiguous","dlpackAccepted":true,"dtype":{"dtypes":["Float32"],"kind":"one_of"},"name":"y","numpyAccepted":true,"optional":false,"ownership":"borrowed","role":"inout","shape":{"argument":"x","kind":"same_as"}}]},{"backendSupport":[{"backend":"cuda","dtypes":["Float32"],"notes":""},{"backend":"hip","dtypes":["Float32"],"notes":""},{"backend":"opencl","dtypes":["Float32"],"notes":""},{"backend":"vulkan","dtypes":["Float32"],"notes":""},{"backend":"metal","dtypes":["Float32"],"notes":""}],"contractId":"navatala://python/linalg/gemm","determinism":"backend_default","dispatchVariants":[],"doc":{"details":"The Python binding validates rank-2 tensors and backend dtype support before dispatch.","examples":[],"summary":"Compute C = alpha * A @ B + beta * C on the selected GPU backend."},"launchPolicy":{"dispatch":null,"gridStride":true,"workgroupSize":null},"maturity":"experimental","module":"linalg","name":"navatala://python/linalg/gemm","preconditions":[{"errorCode":"invalid_shape","expr":{"kind":"bool_literal","value":true},"message":"matrix dimensions must satisfy A[m,k] * B[k,n] -> C[m,n]"}],"publicModule":"linalg","publicName":"linalg.gemm","pythonName":"gemm","releasesGIL":true,"returnsDlpackTensor":true,"scalars":[{"defaultValue":{"kind":"float","value":"1.000000"},"kind":{"kind":"float"},"name":"alpha","optional":true},{"defaultValue":{"kind":"float","value":"0.000000"},"kind":{"kind":"float"},"name":"beta","optional":true},{"defaultValue":{"kind":"string","value":"auto"},"kind":{"kind":"backend"},"name":"backend","optional":true}],"syncPolicy":{"insertsHostSync":false,"notes":"Host synchronization is never inserted by default.","userVisible":"explicit_only"},"target":{"kind":"operation","name":"navatala://python/linalg/gemm/target"},"tensors":[{"contiguity":"c_contiguous","contiguityFallback":"copy_to_contiguous","dlpackAccepted":true,"dtype":{"dtype":"Float32","kind":"fixed"},"name":"a","numpyAccepted":true,"optional":false,"ownership":"borrowed","role":"input","shape":{"dims":["m","k"],"kind":"parametric"}},{"contiguity":"c_contiguous","contiguityFallback":"copy_to_contiguous","dlpackAccepted":true,"dtype":{"dtype":"Float32","kind":"fixed"},"name":"b","numpyAccepted":true,"optional":false,"ownership":"borrowed","role":"input","shape":{"dims":["k","n"],"kind":"parametric"}},{"contiguity":"c_contiguous","contiguityFallback":"copy_to_contiguous","dlpackAccepted":true,"dtype":{"dtype":"Float32","kind":"fixed"},"name":"c","numpyAccepted":true,"optional":false,"ownership":"borrowed","role":"inout","shape":{"dims":["m","n"],"kind":"parametric"}}]},{"backendSupport":[{"backend":"cuda","dtypes":["Float32"],"notes":""},{"backend":"hip","dtypes":["Float32"],"notes":""},{"backend":"opencl","dtypes":["Float32"],"notes":""},{"backend":"vulkan","dtypes":["Float32"],"notes":""},{"backend":"metal","dtypes":["Float32"],"notes":""}],"contractId":"navatala://python/linalg/nrm2","determinism":"backend_default","dispatchVariants":[],"doc":{"details":"The result argument is an explicit scalar float32 Tensor, keeping output allocation visible to the caller.","examples":[],"summary":"Compute result[0] = ||x||_2 on the selected GPU backend."},"launchPolicy":{"dispatch":null,"gridStride":true,"workgroupSize":null},"maturity":"experimental","module":"linalg","name":"navatala://python/linalg/nrm2","preconditions":[{"errorCode":"invalid_shape","expr":{"kind":"bool_literal","value":true},"message":"nrm2 result must be a scalar float32 tensor"}],"publicModule":"linalg","publicName":"linalg.nrm2","pythonName":"nrm2","releasesGIL":true,"returnsDlpackTensor":true,"scalars":[{"defaultValue":{"kind":"string","value":"auto"},"kind":{"kind":"backend"},"name":"backend","optional":true}],"syncPolicy":{"insertsHostSync":false,"notes":"Host synchronization is never inserted by default.","userVisible":"explicit_only"},"target":{"kind":"operation","name":"navatala://python/linalg/nrm2/target"},"tensors":[{"contiguity":"c_contiguous","contiguityFallback":"copy_to_contiguous","dlpackAccepted":true,"dtype":{"dtype":"Float32","kind":"fixed"},"name":"x","numpyAccepted":true,"optional":false,"ownership":"borrowed","role":"input","shape":{"dims":["n"],"kind":"parametric"}},{"contiguity":"c_contiguous","contiguityFallback":"copy_to_contiguous","dlpackAccepted":true,"dtype":{"dtype":"Float32","kind":"fixed"},"name":"result","numpyAccepted":true,"optional":false,"ownership":"output_allocated","role":"output","shape":{"kind":"scalar"}}]},{"backendSupport":[{"backend":"cuda","dtypes":["Float32","UInt32"],"notes":""},{"backend":"hip","dtypes":["Float32","UInt32"],"notes":""},{"backend":"opencl","dtypes":["Float32","UInt32"],"notes":""},{"backend":"vulkan","dtypes":["Float32","UInt32"],"notes":""},{"backend":"metal","dtypes":["Float32","UInt32"],"notes":""}],"contractId":"navatala://python/dataframe/reduce_sum","determinism":"deterministic_required","dispatchVariants":[],"doc":{"details":"The input_valid bitmap uses uint32 words with one bit per row. output is a scalar float32 tensor; output_valid bit 0 is set when at least one element is valid.","examples":[],"summary":"Compute a null-aware float32 column sum."},"launchPolicy":{"dispatch":null,"gridStride":true,"workgroupSize":null},"maturity":"experimental","module":"dataframe","name":"navatala://python/dataframe/reduce_sum","preconditions":[{"errorCode":"invalid_shape","expr":{"kind":"bool_literal","value":true},"message":"data length must be count and input_valid length must be ceil(count / 32)"}],"publicModule":"dataframe","publicName":"dataframe.reduce_sum","pythonName":"reduce_sum","releasesGIL":true,"returnsDlpackTensor":true,"scalars":[{"defaultValue":{"kind":"none"},"kind":{"kind":"nat"},"name":"count","optional":false},{"defaultValue":{"kind":"string","value":"auto"},"kind":{"kind":"backend"},"name":"backend","o